Index,Title,Year,Rating,Genre,Synopsis
1.,Guardians of the Galaxy Vol. 3,2023,8.3,Superhero,"As a baby raccoon, Rocket is a test subject for the High Evolutionary in order to create a Counter-Earth populated by anthropomorphic animals. He becomes friends with Lylla, Teefs, and Floor, three of the High Evolutionary's other test subjects. Rocket displays intelligence and aptitude beyond the other animals and deduces the flaw in the anthropomorphization process, angering the High Evolutionary. They later learn that they will not be part of the new Earth after the High Evolutionary perfects the formula to anthropomorphize. When the High Evolutionary suspects an escape attempt, he kills Lylla, Teefs and Floor, enraging Rocket, who mauls him and escapes.

Years later, the Guardians of the Galaxy have established their headquarters on a rebuilt Knowhere. The night after settling in, they are attacked by Adam Warlock, a super-powered being created out of revenge by his ""mother"" the empress of the Sovereign, Ayesha, for previously stealing from her people. They are ordered to bring Rocket to the High Evolutionary, who has become obsessed with retrieving his subject for the purpose of isolating and replicating Rocket's intellect. During the fight, Rocket is seriously injured, leaving the Guardians unable to tend to his wounds due to a killswitch embedded in him. The team resolve to travel to the Orgoscope, headquarters of the High Evolutionary's company Orgocorp, in the hopes of finding an override code.

With the assistance of the Ravagers and a reluctant 2014-Gamora, the Guardians infiltrate Orgosphere and retrieve Rocket's file. However, they are attacked by Orgosphere's guards, barely escaping after Peter Quill remotely activates the guards' suit jet-packs. They deduce that Theel, one of the High Evolutionary's scientists, may have the override code stored in his memory, and decide to track him down. The team visits Counter-Earth against Gamora's advice, followed by Ayesha and Adam. With help from a family of bat-like humanoids, Quill, Nebula and Groot trace Theel to the High Evolutionary's ship, while Drax and Mantis remain with Gamora and Rocket. Quill and Groot board the High Evolutionary's ship, leaving Nebula behind. Mantis unwillingly accompanies Drax to the High Evolutionary's ship, which begins to launch with Quill and Groot captured on-board, a process that also destroys Counter-Earth.

Gamora stays with Rocket, but is attacked by a pig warrior sent by the High Evolutionary, who, herself, is killed when Warlock arrives looking for Rocket. Gamora overpowers Adam and launches the Guardians' ship. Quill and Groot successfully defeat the High Evolutionary's forces and kill Theel, jumping off with him and retrieving his memory before Gamora meets them. Meanwhile, believing Quill and Groot are still on-board, Nebula, Mantis, and Drax board the High Evolutionary's ship to rescue them, and a weakened Adam senses that his mother is in danger but is too late to save her. On the Guardians' ship, Rocket flat-lines and has a near death experience, where he is met by Lylla, Teefs and Floor, who tell him that his time has not yet come before Quill successfully implements the override code and revives him.

Mantis, Nebula, and Drax come across hordes of imprisoned children on the High Evolutionary's ship before being captured themselves, and placed in a chamber with Abilisks. Mantis is able to persuade the Abilisks to side with them, and the three escape the chamber before reuniting with the Guardians and overpowering the High Evolutionary's army. Kraglin and Cosmo arrive in Knowhere, which Cosmo connects to the High Evolutionary's ship with the help of Nebula and Kraglin, through her powers of telekinesis allowing them to free the captured children.

Rocket discovers a litter of baby raccoons and other test subject animals, but is attacked by a deranged High Evolutionary while attempting to free them before being rescued by the Guardians. The High Evolutionary is left to perish on his ship while the animals are rescued and board Knowhere along with most of the Guardians. After Cosmo is unable to hold the ships together for long enough for him to board, Quill barely escapes, beginning to freeze in space before being rescued by Adam.

The Guardians decide to disband. Quill bestows the rank of Captain of the Guardians upon Rocket before leaving for Earth. Mantis embarks on a journey of self-discovery with the Abilisks. Gamora reunites with the Ravagers, Nebula and Drax remain on Knowhere to raise the rescued children.

In a mid-credits scene: Captain Rocket is seen leading the new Guardians of the Galaxy, composed of a fully-grown Groot, Adam, Cosmo, Phyla-Vell, Kraglin and Blurp as they prepare a new mission.

In a post-credits scene: Quill reconnects with his grandfather."
3.,The Super Mario Bros. Movie,2023,7.2,Superhero,"The movie starts with Bowser's ship landing in front of the penguin king's palace in the penguin kingdom.Then, Bowser (Jack Black) tells the penguins to either come out or die, to which they come out and fight him, using snowballs. however they only take out one man using a catapult and an ice block. then, the penguin king (Khary Peyton) informs Bowser that ""that is but a taste of our fury"" and questions if they yield. to which Bowser laughs and informs that he does not. he then has his henchman, Kamek (Kevin Michael Richardson) remove them from the area using magic. then, Bowser burns the palace down to the ground, and Kamek uses his magic (and the remaining rubble) to make stairs for Bowser. once Bowser climbs up the stairs, he punches a ? block, uncovering a super star. He then boasts that no one can stop him at this point. in the next scene, Mario (Chris Pratt) and Luigi (Charlie Day) are watching their plumbing ad that they spent all their savings on in a pizzaria called Punch Out! Pizza. after that, they are made fun of by their former boss, Foreman Spike (Sebastian Maniscalco) who resents them for quiting their job with him to start their own plumbing business. he jokes with them that they probably didn't even get a call yet and calls them ""The Stupid Mario Brothers"" and attemps to throw his napkin at Luigi's face, but Mario catches it and stands up for himself and his brother. Just then, they recieve a call from a couple in Brooklyn for a plumbing job. when they get into their car however, it wont start, so they walk and take a shortcut through a construction site. when they get their they meet the couples dog, Francis who starts out liking them, but after Luigi accidentally stepped on Francis' bone, Francis no longer liked them. then, they fixed the leak in the house, but are confronted by Francis, who attacks them and wrecks the faucet. When they get back home, even their family makes fun of them. However, their mom (Jessica Dicicco) supports them. when Mario asks his Dad (Charles Martinet) what he thinks his dad tells him that hes crazy and that the worst thing about it is that he's "" Bringing your brother down with you"". after that, Mario leaves the table and plays Kid Icaris on his NES. then, Luigi walks into their room and comforts him, telling him that hes not bringing him down with him. then, on the news, Mario and Luigi learn that there's a problem with the brooklyn water main, so they set out to fix it. after they get into the sewers, they accidentally fall into a hidden part of the sewers, and discover a warp pipe. Luigi goes inside, and gets sucked in, prompting Mario to go after him. then, they are both sucked into the warp zone, and are separated. Mario gets sent to the Mushroom Kingdom, where he meets Toad (Keegan Michael Key). after Mario discribes the place Luigi got sent to, Toad is convinced that he ended up in The Darklands, a land ruled by Bowser. However, Toad tells Mario that the ruler of the Mushroom Kingdom, Princess Peach (Anya Taylor-Joy), will be able to help him, so they set out to find her. Back in the Darklands, Luigi realizes that Mario isn't there. He is then Chased by Dry Bones and escapes by getting inside a castle and locking the door, but is then captured by Shy Guys. Back at the mushroom kingdom, Mario and Toad travel through the mushroom kingdom and make it to Peach's Castle. when they get to the castle door, however, the guards tell them that "" Your Princess is in another castle"" but after toad cooks them up some food, they let Mario pass. in Peach's throne room, one of her councilmen tell her that Bowser is coming to the Mushroom Kingdom next. however, Peach informs him that she is planing to make an alliance with the kong army from the Jungle Kingdom. Just then, when she walks out of her throne room, she meets Mario and both are surprised to see a human. Mario tells her that his brother is in the Darklands, and she tells him that she is going to the jungle kingdom to make an alliance to stop Bowser, so they both team up, and peach tells him that he can come with her... If he finishes a Practice course. However, He fails Multiple times, and gets so close to finishing it, but is stopped by an obstacle. however, peach still agrees to let him come with her, and attempts to make him feel better by telling him that she only finished it on her first try because she grew up there. back in the darklands, Luigi is headed towards bowsers castle in a hot air balloon. Back at Bowsers castle, bowser sings a song about how he only desires to marry peach and rule the world with her, but he is interrupted by Kamek who informs him that Mario and Peach are headed to The Jungle Kingdom to make an alliance with them, and bowser sees him as a competitor over peach's affections. back to Mario and Peach, after travelling through the Bomb-Omb battlefield, the Desert Kingdom, and Yoshi's Island, they Finally make it to a Fire Flower Field. There, Peach activates the fire flower and uses it to ignite a campfire. she then notices that Mario is upset about something and asks him if he is worrying about his brother, and Mario tells her that he is and that they've never been apart that long before. she comforts him, telling him that they are going to save his brother. mario then asks peach where she is from, and she tells him that she is not sure, and that her first memory was arriving in the mushroom kingdom. Mario tells her that she might be from his world, and they gaze up at the stars. back to bowser, bowser is informed that the koopas had captured Luigi and found him wandering around. bowser brings luigi in to interrogate him. at first, Luigi is reluctant to reveal whether Mario is his Brother or not, but after bowser looses his temper, Luigi spills the beans. bowser asks him if princesses find mario attractive and luigi tells him they do if they have good taste. then, mario, peach, and toad end up at the jungle kingdom, and are given a ride through the city and dropped of at Cranky Kong's Palace, but Cranky Kong (Fred Armisen) refuses to make an alliance. but after Mario tells him that they aren't leaving without the kongs army, Cranky Kong tells Mario that he can have the army if Mario can beat His Son in a wrestling match in the Great Ring of Kong. Mario Agrees. Peach, However informs him that it is a very (very) bad idea. when Mario Starts the Fight with cranky's son, Donkey Kong (Seth Rogen), it starts out rough, but mario remember what peach told him about the power ups. then mario gets a mushroom that he thinks is the Super Mushroom, but after eating it, discovers that it is actually a mini mushroom. after returning to regular size, Mario attempts to use the fire flower, but Donkey Kong blows it out, rendering it useless. then, after getting the cat bell, Mario defeats Donkey Kong. Peach tells mario that she is proud of him and that he never gave up. then, Cranky sugests that they get back home by taking rainbow road. however bowser learns of this and dispatches his army to stop them. in the end, Mario and Donkey Kong get sent of the track and into the belly of a sea beast, while the kong army are captured, leaving only peach and toad left. when they get back peach gets everyone to evacuate, and sets out to try and stop bowser herself. when bowser gets their and proposes to peach, she declines, telling him that she would never marry him. however, when bowser gets kamek to torture toad using his magic, she quickly complies. back to Mario and Donkey Kong, they escape the beast using a rocket from DK's kart. then toad hands peach a bouquet, and peach walks up to bowser, only to discover (to her horror) people dangling from a cage above a pool of lava. bowser tells her that he will be sacrificing them in her honor, and lowers the prisoners. just before kamek can start reading the wedding book though, peach knocks him out and reveals a ice flower in her bouquet, activates it and uses it to stop the prisoners from being lowered (Luigi being one of them) and to freeze bowser. back to mario, mario and donkey kong make it and save luigi. but then, bowser orders a boomer bill be launched to destroy the mushroom kingdom, but mario stops it by luring it into the warp pipe, using the super leaf. after this it causes everyone to get sucked into brooklyn, and, after a brief fight with bowser, mario realizes that he may not be able to win this one. but after seeing his friends getting hurt, and watching his plumping ad which is playing on the tv in punch out pizza, he gains enough strength to fight bowser one last time. mario attempts to steal the super star from bowser, but bowser attempts to stop him using his fire breath. however, luigi saves mario by using a manhole cover as a shield. then they lunge forward to get the super star. at first, they are thought to have been scorched by the flames, but it turns out that they activated the super star at the last second, making them invincible. then, they defeat bowser and are acknowledged as a hero by marios family, foreman spike, and even francis. as for bowser, he is shrinked using the mini mushroom and put in a bottle. at the end, it shows that mario and luigi have moved into a house in the mushroom kingdom.

End Credit Scene #1 Bowser sings the second part of his song, and is told to be quiet by one of the guards in peachs castle.

End Credit Scene #2 a yoshi egg hatches, and, just when the screen goes black we hear him say ""Yoshi!"""
4.,Dungeons & Dragons: Honor Among Thieves,2023,7.4,Superhero,"Prior to imprisonment, bard Edgin Darvis served as a member of the Harpers, an order of peacekeepers, until disciples of a Red Wizard he had arrested killed his wife. Accompanied by barbarian Holga Kilgore, Edgin attempted to make a new life for himself and his daughter Kira by turning to theft, teaming with amateur sorcerer Simon Aumar, rogue Forge Fitzwilliam, and Forge's mysterious acquaintance, Sofina. While raiding a Harper stronghold, Edgin attempted to steal a ""Tablet of Reawakening"" to resurrect his wife, but he and Holga are captured while their accomplice's escape.

After two years in Revel's End arctic prison, the pair escape to Neverwinter and learn Forge has become Lord there, after its prior lord fell mysteriously incapacitated. Forge has been taking care of Kira, convincing her that Edgin's selfish greed led to his arrest. Sofina is revealed as a Red Wizard, and she and Forge deliberately orchestrated their capture. Sofina attempts to execute Edgin and Holga, but they escape and decide to rob Forge's vault and bring Kira home during the upcoming High Sun Games, needing the tablet to prove their innocence to Kira and resurrect Edgin's wife.

The gladiatorial games had previously been banned, but Forge re-instituted them, promising that the games would bring in tourists and money. Edgin and Holga track down Simon to help and he suggests also recruiting Doric, a Tiefling druid, whose forest community is fighting forced logging ordered by Forge. Shapeshifted into a fly, Doric infiltrates Forge's castle, finding the vault has magical defenses from Mordenkainen, which Simon lacks power to disable. Simon proposes that a magic relic, ""The Helm of Disjunction,"" could disable them. They travel to an old graveyard to ask Holga's ancestors where to find it. Simon resurrects the dead with a talisman long enough for them to answer five questions each; the corpses reveal they gave the Helm to Xenk Yandar, a paladin who fled his country, Thay, when Red Wizards turned his people into an undead army. One corpse is left ""alive"", not having been asked all five questions.

Xenk, after forcing Edgin to swear to distribute any gained bounty to the people, guides the group through the Underdark to retrieve the Helm. With the help of a teleportation staff obtained from Holga's halfling ex-husband, they find the relic, but are attacked by Thayan assassins sent by Sofina. Xenk fights off the assassins and helps the group escape from Themberchaud, a pudgy red dragon, before departing. Simon has trouble mastering the Helm's power, so they decide to use the staff to enter the vault during the games. Simon and Holga infiltrate the magically sealed door but find the room empty except for a magical trap. Sofina, disguised as Kira, subdues Edgin.

The group is captured and forced to participate in the games but manages to escape the stadium. Doric discovers Forge has loaded the treasure onto a boat and is preparing to flee; the group steals the boat for themselves and rescues Kira from Forge, who threatened Kira's life. As they escape, the group realize Sofina organized the games to draw a massive crowd and turn them into an undead army using the curse that destroyed Thay. The group returns, transporting Forge's stolen riches out of the boat with the teleportation staff and spreading them across the city by hot-air balloon, drawing the people out of the stadium before Sofina's spell takes effect. Outraged at her defeat, Sofina attacks the group, but Simon can master his magic and nullify Sofina's time-stop spell, allowing Kira to use an invisibility pendant Edgin and Holga gave her as a child to place an anti-magic bracelet on Sofina. Sofina is killed when attacked by Doric in owl-bear form and then crushed by falling debris, but Holga is fatally injured.

Edgin uses the tablet to bring her back to life, accepting that he wanted to bring back his wife only for his own sake while Holga had become a true part of their family. Doric signals openness to a relationship with Simon. Restored, the old Lord of Neverwinter declares the team heroes of the realm while Doric's people are given sovereignty over their foreseted land to protect as they see fit, and Forge, who is captured by Xenk while trying to escape, is sent to Revel's End, spectacularly failing to escape as Edgin and Holga did."
8.,A Man Called Otto,2022,7.5,Superhero,"Otto Anderson, a 63-year-old widower, lives in suburban Pittsburgh, Pennsylvania. After retiring from a steel company, he plans suicide, having lost his wife Sonya, a schoolteacher, six months previously.

During a suicide attempt by hanging, he is interrupted by his new neighbors: Marisol, Tommy, and their two daughters, Abby and Luna. Otto has flashbacks to his past; years previously he tried to enlist in the army but was rejected due to his hypertrophic cardiomyopathy. He meets Sonya on a train after returning a book she dropped.

Otto attempts suicide again, this time via carbon monoxide poisoning. He experiences a flashback to a dinner with Sonya, confessing to her that he is not enlisted in the army due to his heart condition and does not have a job, prompting Sonya to kiss him. Marisol disrupts Otto's suicide attempt, asking him to take her and her kids to the hospital after Tommy fell and broke his leg using a ladder Otto had lent to him. Otto reluctantly agrees.

Otto has a flashback to his graduation when he asked Sonya to marry him. During a suicide attempt by train, an old man faints and falls on the railroad tracks. Otto saves the man and the incident goes viral. Otto takes Marisol for a driving lesson and they visit Sonya's favorite bakery, which the couple formerly frequented every weekend. There, he tells her about his friendship with a man named Reuben, the two having worked together to establish rules and order, with Otto as chairman of the neighborhood association board. The two grew apart after Reuben's preference for Fords and Toyotas over Otto's Chevrolets and the ""coup"" of replacing Otto as chairman. Reuben, who had a stroke, now uses a wheelchair and is cared for by his wife Anita and neighbor Jimmy.

A local transgender teen, Malcolm, recognizes Otto as Sonya's husband while delivering newspapers and circulars in the neighborhood. Malcolm cuts through Otto's disgruntlement at receipt of the newspapers and recounts that Sonya was his teacher, and one of the few people who accepted him as he was. A friendship forms between the pair and Otto fixes Malcolm's bicycle. After dodging a social media journalist named Shari Kenzie who is attempting to interview him in relation to the earlier viral video, Otto gets angry at both Marisol and a Dye & Merika real estate agent, not wanting to come to terms with Sonya's death. He attempts to commit suicide by shotgun, but is interrupted by Malcolm, who asks to spend the night after his father kicked him out.

Otto learns that Dye & Merika is planning to force Reuben into a nursing home and take their house, after illegally finding out that Anita was diagnosed with Parkinson's disease. Otto agrees to help Anita and Reuben. Marisol refuses to assist Otto until he tells her that he and Sonya went to Niagara Falls to celebrate Sonya's pregnancy. On the bus back home, they were involved in a crash, and Sonya became paralyzed and had a miscarriage. The neighborhood was not accessible to Sonya and Otto was voted out of the chairmanship after a heated confrontation with a Dye & Merika representative. Otto wanted to put all of the real estate companies out of business but decided against it to care for Sonya. With the help of the neighborhood and Shari Kenzie, Reuben and Anita are able to keep their home.

Otto collapses and is taken to the hospital, where he lists Marisol as his next of kin. After being told by a cardiologist that Otto's heart is too big, she laughs, before going into labor and gives birth to a son.

One day, Tommy notices that Otto did not shovel the snow on his walkway. Marisol and Tommy enter Otto's house to find him dead, having succumbed to his enlarged heart. A funeral is held, attended by his neighbors. In a letter to Marisol, Otto says that his lawyer will give her his bank accounts, providing them with enough money to take care of her family, along with his new car and house."
